sentence	name	link
" И к концу второй минуты я отчаялся его найти ""Конец, — подумал я, — зачем я это сделал?"	Михаил Булгаков. Стальное горло.	http://az.lib.ru/b/bulgakow_m_a/text_03_1925_stalnoe_gorlo.shtml
" Ведь мог же я не предлагать операцию, и Лидка спокойно умерла бы у меня в палате, а теперь умрет с разорванным горлом, и никогда, ничем я не докажу, что она все равно умерла бы, что я не мог повредить ей..."" Акушерка молча вытерла мой лоб."	Михаил Булгаков. Стальное горло.	http://az.lib.ru/b/bulgakow_m_a/text_03_1925_stalnoe_gorlo.shtml
" ""Положить нож, сказать: не знаю, что дальше делать"", — так подумал я, и мне представились глаза матери."	Михаил Булгаков. Стальное горло.	http://az.lib.ru/b/bulgakow_m_a/text_03_1925_stalnoe_gorlo.shtml
 Я снова поднял нож и бессмысленно, глубоко и резко полоснул Лидку.	Михаил Булгаков. Стальное горло.	http://az.lib.ru/b/bulgakow_m_a/text_03_1925_stalnoe_gorlo.shtml
 Ткани разъехались, и неожиданно передо мной оказалось дыхательное горло.	Михаил Булгаков. Стальное горло.	http://az.lib.ru/b/bulgakow_m_a/text_03_1925_stalnoe_gorlo.shtml
 — Крючки! — сипло бросил я.	Михаил Булгаков. Стальное горло.	http://az.lib.ru/b/bulgakow_m_a/text_03_1925_stalnoe_gorlo.shtml
 Фельдшер подал их.	Михаил Булгаков. Стальное горло.	http://az.lib.ru/b/bulgakow_m_a/text_03_1925_stalnoe_gorlo.shtml
 Я вонзил один крючок с одной стороны, другой — с другой, и один из них передал фельдшеру.	Михаил Булгаков. Стальное горло.	http://az.lib.ru/b/bulgakow_m_a/text_03_1925_stalnoe_gorlo.shtml
 Теперь я видел только одно: сероватые колечки горла.	Михаил Булгаков. Стальное горло.	http://az.lib.ru/b/bulgakow_m_a/text_03_1925_stalnoe_gorlo.shtml
 Острый нож я вколол в горло — и обмер.	Михаил Булгаков. Стальное горло.	http://az.lib.ru/b/bulgakow_m_a/text_03_1925_stalnoe_gorlo.shtml
 Горло поднялось из раны, фельдшер, как мелькнуло у меня в голове, сошел с ума: он стал вдруг выдирать его вон.	Михаил Булгаков. Стальное горло.	http://az.lib.ru/b/bulgakow_m_a/text_03_1925_stalnoe_gorlo.shtml
 Ахнули за спиной у меня обе акушерки.	Михаил Булгаков. Стальное горло.	http://az.lib.ru/b/bulgakow_m_a/text_03_1925_stalnoe_gorlo.shtml
" Я поднял глаза и понял, в чем дело: фельдшер, оказывается, стал падать в обморок от духоты и, не выпуская крючка, рвал дыхательное горло ""все против меня, судьба, — Подумал я, — теперь уж, несомненно, зарезали мы девочку, — и мысленно строго добавил: — Только дойду домой — и застрелюсь..."" Тут старшая акушерка, видимо, очень опытная, как-то хищно рванулась к фельдшеру и перехватила у него крючок, причем сказала, стиснув зубы: — Продолжайте, доктор..."	Михаил Булгаков. Стальное горло.	http://az.lib.ru/b/bulgakow_m_a/text_03_1925_stalnoe_gorlo.shtml
 Фельдшер со стуком упал, ударился, но мы не глядели на него.	Михаил Булгаков. Стальное горло.	http://az.lib.ru/b/bulgakow_m_a/text_03_1925_stalnoe_gorlo.shtml
 Я вколол нож в горло, затем серебряную трубку вложил в него.	Михаил Булгаков. Стальное горло.	http://az.lib.ru/b/bulgakow_m_a/text_03_1925_stalnoe_gorlo.shtml
 Она ловко вскользнула, но Лидка осталась недвижимой.	Михаил Булгаков. Стальное горло.	http://az.lib.ru/b/bulgakow_m_a/text_03_1925_stalnoe_gorlo.shtml
 Воздух не вошел к ней в горло, как это нужно было.	Михаил Булгаков. Стальное горло.	http://az.lib.ru/b/bulgakow_m_a/text_03_1925_stalnoe_gorlo.shtml
 Я глубоко вздохнул и остановился: больше делать мне было нечего.	Михаил Булгаков. Стальное горло.	http://az.lib.ru/b/bulgakow_m_a/text_03_1925_stalnoe_gorlo.shtml
 Мне хотелось у кого-то попросить прощенья, покаяться в своем легкомыслии, в том, что я поступил на медицинский факультет.	Михаил Булгаков. Стальное горло.	http://az.lib.ru/b/bulgakow_m_a/text_03_1925_stalnoe_gorlo.shtml
 Стояло молчание.	Михаил Булгаков. Стальное горло.	http://az.lib.ru/b/bulgakow_m_a/text_03_1925_stalnoe_gorlo.shtml
 Я видел, как Лидка синела.	Михаил Булгаков. Стальное горло.	http://az.lib.ru/b/bulgakow_m_a/text_03_1925_stalnoe_gorlo.shtml
 Я хотел уже все бросить и заплакать, как вдруг Лидка дико содрогнулась, фонтаном выкинула дрянные сгустки сквозь трубку, и воздух со свистом вошел к ней в горло, потом девочка задышала и стала реветь.	Михаил Булгаков. Стальное горло.	http://az.lib.ru/b/bulgakow_m_a/text_03_1925_stalnoe_gorlo.shtml
 Фельдшер в это мгновение привстал, бледный и потный, тупо и в ужасе поглядел на горло и стал помогать мне его зашивать.	Михаил Булгаков. Стальное горло.	http://az.lib.ru/b/bulgakow_m_a/text_03_1925_stalnoe_gorlo.shtml
 Сквозь сон и пелену пота, застилавшую мне глаза, я видел счастливые лица акушерок, и одна из них мне сказала: — Ну и блестяще же вы сделали, доктор, операцию.	Михаил Булгаков. Стальное горло.	http://az.lib.ru/b/bulgakow_m_a/text_03_1925_stalnoe_gorlo.shtml
 Я подумал, что она смеется надо мной, и мрачно, исподлобья глянул на нее.	Михаил Булгаков. Стальное горло.	http://az.lib.ru/b/bulgakow_m_a/text_03_1925_stalnoe_gorlo.shtml
 Потом распахнулись двери, повеяло свежестью.	Михаил Булгаков. Стальное горло.	http://az.lib.ru/b/bulgakow_m_a/text_03_1925_stalnoe_gorlo.shtml
 Лидку вынесли в простыне, и сразу же в дверях показалась мать.	Михаил Булгаков. Стальное горло.	http://az.lib.ru/b/bulgakow_m_a/text_03_1925_stalnoe_gorlo.shtml
 Глаза у нее были как у дикого зверя.	Михаил Булгаков. Стальное горло.	http://az.lib.ru/b/bulgakow_m_a/text_03_1925_stalnoe_gorlo.shtml
 Она когда я услышал звук ее голоса, пот потек у меня по спине, я только тогда сообразил, что было бы, если бы Лидка умерла на столе.	Михаил Булгаков. Стальное горло.	http://az.lib.ru/b/bulgakow_m_a/text_03_1925_stalnoe_gorlo.shtml
 Но голосом очень спокойным я ей ответил: — Будь поспокойнее.	Михаил Булгаков. Стальное горло.	http://az.lib.ru/b/bulgakow_m_a/text_03_1925_stalnoe_gorlo.shtml
 Жива.	Михаил Булгаков. Стальное горло.	http://az.lib.ru/b/bulgakow_m_a/text_03_1925_stalnoe_gorlo.shtml
 Будет, надеюсь, жива.	Михаил Булгаков. Стальное горло.	http://az.lib.ru/b/bulgakow_m_a/text_03_1925_stalnoe_gorlo.shtml
 Только, пока трубку не вынем, ни слова не будет говорить, так не бойтесь.	Михаил Булгаков. Стальное горло.	http://az.lib.ru/b/bulgakow_m_a/text_03_1925_stalnoe_gorlo.shtml
 И тут бабка выросла из-под земли и перекрестилась на дверную ручку, на меня, на потолок.	Михаил Булгаков. Стальное горло.	http://az.lib.ru/b/bulgakow_m_a/text_03_1925_stalnoe_gorlo.shtml
 Но я уж не рассердился на нее.	Михаил Булгаков. Стальное горло.	http://az.lib.ru/b/bulgakow_m_a/text_03_1925_stalnoe_gorlo.shtml
 Повернулся, приказал Лидке впрыснуть камфару и по очереди дежурить возле нее.	Михаил Булгаков. Стальное горло.	http://az.lib.ru/b/bulgakow_m_a/text_03_1925_stalnoe_gorlo.shtml
 Затем ушел к себе через двор.	Михаил Булгаков. Стальное горло.	http://az.lib.ru/b/bulgakow_m_a/text_03_1925_stalnoe_gorlo.shtml
 Помню, синий свет горел у меня в кабинете, лежал Додерляйн, валялись книги.	Михаил Булгаков. Стальное горло.	http://az.lib.ru/b/bulgakow_m_a/text_03_1925_stalnoe_gorlo.shtml
 Я подошел к дивану одетый, лег на него и сейчас же перестал видеть что бы то ни было; заснул и даже снов не видел.	Михаил Булгаков. Стальное горло.	http://az.lib.ru/b/bulgakow_m_a/text_03_1925_stalnoe_gorlo.shtml
 Прошел месяц, другой.	Михаил Булгаков. Стальное горло.	http://az.lib.ru/b/bulgakow_m_a/text_03_1925_stalnoe_gorlo.shtml
 Много я уже перевидал, и было уже кое-что страшнее Лидкиного горла.	Михаил Булгаков. Стальное горло.	http://az.lib.ru/b/bulgakow_m_a/text_03_1925_stalnoe_gorlo.shtml
 Я про него и забыл.	Михаил Булгаков. Стальное горло.	http://az.lib.ru/b/bulgakow_m_a/text_03_1925_stalnoe_gorlo.shtml
 Кругом был снег, прием увеличивался с каждым днем.	Михаил Булгаков. Стальное горло.	http://az.lib.ru/b/bulgakow_m_a/text_03_1925_stalnoe_gorlo.shtml
 И как-то, в новом уже году, вошла ко мне в приемную женщина и ввела за ручку закутанную, как тумбочка, девчонку.	Михаил Булгаков. Стальное горло.	http://az.lib.ru/b/bulgakow_m_a/text_03_1925_stalnoe_gorlo.shtml
 Женщина сияла глазами.	Михаил Булгаков. Стальное горло.	http://az.lib.ru/b/bulgakow_m_a/text_03_1925_stalnoe_gorlo.shtml
 Я всмотрелся — узнал.	Михаил Булгаков. Стальное горло.	http://az.lib.ru/b/bulgakow_m_a/text_03_1925_stalnoe_gorlo.shtml
 — А, Лидка!	Михаил Булгаков. Стальное горло.	http://az.lib.ru/b/bulgakow_m_a/text_03_1925_stalnoe_gorlo.shtml
 Ну, что?	Михаил Булгаков. Стальное горло.	http://az.lib.ru/b/bulgakow_m_a/text_03_1925_stalnoe_gorlo.shtml
 — Да хорошо все.	Михаил Булгаков. Стальное горло.	http://az.lib.ru/b/bulgakow_m_a/text_03_1925_stalnoe_gorlo.shtml
 Лидке распутали горло.	Михаил Булгаков. Стальное горло.	http://az.lib.ru/b/bulgakow_m_a/text_03_1925_stalnoe_gorlo.shtml
 Она дичилась и боялась, но все же мне удалось поднять подбородок и заглянуть.	Михаил Булгаков. Стальное горло.	http://az.lib.ru/b/bulgakow_m_a/text_03_1925_stalnoe_gorlo.shtml
 На розовой шее был вертикальный коричневый шрам и два тоненьких поперечных от швов.	Михаил Булгаков. Стальное горло.	http://az.lib.ru/b/bulgakow_m_a/text_03_1925_stalnoe_gorlo.shtml
 — Все в порядке, — сказал я, — можете больше не приезжать.	Михаил Булгаков. Стальное горло.	http://az.lib.ru/b/bulgakow_m_a/text_03_1925_stalnoe_gorlo.shtml
 — Благодарю вас, доктор, спасибо, — сказала мать, а Лидке велела: — Скажи дяденьке спасибо!	Михаил Булгаков. Стальное горло.	http://az.lib.ru/b/bulgakow_m_a/text_03_1925_stalnoe_gorlo.shtml
 Но Лидка не желала мне ничего говорить.	Михаил Булгаков. Стальное горло.	http://az.lib.ru/b/bulgakow_m_a/text_03_1925_stalnoe_gorlo.shtml
 Больше я никогда в жизни ее не видел.	Михаил Булгаков. Стальное горло.	http://az.lib.ru/b/bulgakow_m_a/text_03_1925_stalnoe_gorlo.shtml
 Я стал забывать ее.	Михаил Булгаков. Стальное горло.	http://az.lib.ru/b/bulgakow_m_a/text_03_1925_stalnoe_gorlo.shtml
 А прием мой все возрастал.	Михаил Булгаков. Стальное горло.	http://az.lib.ru/b/bulgakow_m_a/text_03_1925_stalnoe_gorlo.shtml
 Вот настал день, когда я принял сто десять человек.	Михаил Булгаков. Стальное горло.	http://az.lib.ru/b/bulgakow_m_a/text_03_1925_stalnoe_gorlo.shtml
 Мы начали в девять часов утра и кончили в восемь часов вечера.	Михаил Булгаков. Стальное горло.	http://az.lib.ru/b/bulgakow_m_a/text_03_1925_stalnoe_gorlo.shtml
 Я, пошатываясь, снимал халат.	Михаил Булгаков. Стальное горло.	http://az.lib.ru/b/bulgakow_m_a/text_03_1925_stalnoe_gorlo.shtml
 Старшая акушерка-фельдшерица сказала мне: — За такой прием благодарите трахеотомию.	Михаил Булгаков. Стальное горло.	http://az.lib.ru/b/bulgakow_m_a/text_03_1925_stalnoe_gorlo.shtml
 Вы знаете, что в деревнях говорят?	Михаил Булгаков. Стальное горло.	http://az.lib.ru/b/bulgakow_m_a/text_03_1925_stalnoe_gorlo.shtml
 Будто вы больной Лидке вместо ее горла вставили стальное и зашили.	Михаил Булгаков. Стальное горло.	http://az.lib.ru/b/bulgakow_m_a/text_03_1925_stalnoe_gorlo.shtml
 Специально ездят в эту деревню глядеть на нее.	Михаил Булгаков. Стальное горло.	http://az.lib.ru/b/bulgakow_m_a/text_03_1925_stalnoe_gorlo.shtml
 Вот вам и слава, доктор, поздравляю.	Михаил Булгаков. Стальное горло.	http://az.lib.ru/b/bulgakow_m_a/text_03_1925_stalnoe_gorlo.shtml
 — Так и живет со стальным? — осведомился я.	Михаил Булгаков. Стальное горло.	http://az.lib.ru/b/bulgakow_m_a/text_03_1925_stalnoe_gorlo.shtml
 — Так и живет.	Михаил Булгаков. Стальное горло.	http://az.lib.ru/b/bulgakow_m_a/text_03_1925_stalnoe_gorlo.shtml
 Ну, а вы доктор, молодец.	Михаил Булгаков. Стальное горло.	http://az.lib.ru/b/bulgakow_m_a/text_03_1925_stalnoe_gorlo.shtml
 И хладнокровно как делаете, прелесть!	Михаил Булгаков. Стальное горло.	http://az.lib.ru/b/bulgakow_m_a/text_03_1925_stalnoe_gorlo.shtml
 — М-да... я, знаете ли, никогда не волнуюсь, — сказал я неизвестно зачем, но почувствовал, что от усталости даже устыдиться не могу, только глаза отвел в сторону.	Михаил Булгаков. Стальное горло.	http://az.lib.ru/b/bulgakow_m_a/text_03_1925_stalnoe_gorlo.shtml
 Попрощался и ушел к себе.	Михаил Булгаков. Стальное горло.	http://az.lib.ru/b/bulgakow_m_a/text_03_1925_stalnoe_gorlo.shtml
 Крупный снег шел, все застилало.	Михаил Булгаков. Стальное горло.	http://az.lib.ru/b/bulgakow_m_a/text_03_1925_stalnoe_gorlo.shtml
 Фонарь горел, и дом мой был одинок, спокоен и важен.	Михаил Булгаков. Стальное горло.	http://az.lib.ru/b/bulgakow_m_a/text_03_1925_stalnoe_gorlo.shtml
 И я, когда шел, хотел одного — спать.	Михаил Булгаков. Стальное горло.	http://az.lib.ru/b/bulgakow_m_a/text_03_1925_stalnoe_gorlo.shtml
 Где же весь мир в день моего рождения?	Михаил Булгаков. Тьма египетская.	http://az.lib.ru/b/bulgakow_m_a/text_04_1925_tma_egipetskaya.shtml
 Где электрические фонари Москвы?	Михаил Булгаков. Тьма египетская.	http://az.lib.ru/b/bulgakow_m_a/text_04_1925_tma_egipetskaya.shtml
 Люди?	Михаил Булгаков. Тьма египетская.	http://az.lib.ru/b/bulgakow_m_a/text_04_1925_tma_egipetskaya.shtml
 Небо?	Михаил Булгаков. Тьма египетская.	http://az.lib.ru/b/bulgakow_m_a/text_04_1925_tma_egipetskaya.shtml
 За окошками нет ничего!	Михаил Булгаков. Тьма египетская.	http://az.lib.ru/b/bulgakow_m_a/text_04_1925_tma_egipetskaya.shtml
 Тьма...	Михаил Булгаков. Тьма египетская.	http://az.lib.ru/b/bulgakow_m_a/text_04_1925_tma_egipetskaya.shtml
 Мы отрезаны от людей.	Михаил Булгаков. Тьма египетская.	http://az.lib.ru/b/bulgakow_m_a/text_04_1925_tma_egipetskaya.shtml
 Первые керосиновые фонари от нас в девяти верстах на станции железной дороги.	Михаил Булгаков. Тьма египетская.	http://az.lib.ru/b/bulgakow_m_a/text_04_1925_tma_egipetskaya.shtml
 Мигает там, наверное, фонарик, издыхает от метели.	Михаил Булгаков. Тьма египетская.	http://az.lib.ru/b/bulgakow_m_a/text_04_1925_tma_egipetskaya.shtml
 Пройдет в полночь с воем скорый в Москву и даже не остановится — не нужна ему забытая станция, погребенная в буране.	Михаил Булгаков. Тьма египетская.	http://az.lib.ru/b/bulgakow_m_a/text_04_1925_tma_egipetskaya.shtml
 Разве что занесет пути.	Михаил Булгаков. Тьма египетская.	http://az.lib.ru/b/bulgakow_m_a/text_04_1925_tma_egipetskaya.shtml
 Первые электрические фонари в сорока верстах, в уездном городе.	Михаил Булгаков. Тьма египетская.	http://az.lib.ru/b/bulgakow_m_a/text_04_1925_tma_egipetskaya.shtml
 Там сладостная жизнь.	Михаил Булгаков. Тьма египетская.	http://az.lib.ru/b/bulgakow_m_a/text_04_1925_tma_egipetskaya.shtml
 Кинематограф есть, магазины.	Михаил Булгаков. Тьма египетская.	http://az.lib.ru/b/bulgakow_m_a/text_04_1925_tma_egipetskaya.shtml
 В то время как воет и валит снег на полях, на экране, возможно, плывет тростник, качаются пальмы, мигает тропический остров.	Михаил Булгаков. Тьма египетская.	http://az.lib.ru/b/bulgakow_m_a/text_04_1925_tma_egipetskaya.shtml
 Мы же одни.	Михаил Булгаков. Тьма египетская.	http://az.lib.ru/b/bulgakow_m_a/text_04_1925_tma_egipetskaya.shtml
 — Тьма египетская, — заметил фельдшер Демьян Лукич, приподняв штору.	Михаил Булгаков. Тьма египетская.	http://az.lib.ru/b/bulgakow_m_a/text_04_1925_tma_egipetskaya.shtml
 Выражается он торжественно, но очень метко.	Михаил Булгаков. Тьма египетская.	http://az.lib.ru/b/bulgakow_m_a/text_04_1925_tma_egipetskaya.shtml
 Именно египетская.	Михаил Булгаков. Тьма египетская.	http://az.lib.ru/b/bulgakow_m_a/text_04_1925_tma_egipetskaya.shtml
 — Прошу еще по рюмочке, — пригласил я.	Михаил Булгаков. Тьма египетская.	http://az.lib.ru/b/bulgakow_m_a/text_04_1925_tma_egipetskaya.shtml
 (Ах, не осуждайте!	Михаил Булгаков. Тьма египетская.	http://az.lib.ru/b/bulgakow_m_a/text_04_1925_tma_egipetskaya.shtml
 Ведь врач, фельдшер, две акушерки, ведь мы тоже люди!	Михаил Булгаков. Тьма египетская.	http://az.lib.ru/b/bulgakow_m_a/text_04_1925_tma_egipetskaya.shtml
 Мы не видим целыми месяцами никого, кроме сотен больных.	Михаил Булгаков. Тьма египетская.	http://az.lib.ru/b/bulgakow_m_a/text_04_1925_tma_egipetskaya.shtml
 Мы работаем, мы погребены в снегу.	Михаил Булгаков. Тьма египетская.	http://az.lib.ru/b/bulgakow_m_a/text_04_1925_tma_egipetskaya.shtml
 Неужели же нельзя нам выпить по две рюмки разведенного спирту по рецепту и закусить уездными шпротами в день рождения врача?) — За ваше здоровье, доктор! — прочувственно сказал Демьян Лукич.	Михаил Булгаков. Тьма египетская.	http://az.lib.ru/b/bulgakow_m_a/text_04_1925_tma_egipetskaya.shtml
 — Желаем вам привыкнуть у нас! — сказала Анна Николаевна и, чокаясь, поправила парадное свое платье с разводами.	Михаил Булгаков. Тьма египетская.	http://az.lib.ru/b/bulgakow_m_a/text_04_1925_tma_egipetskaya.shtml
 Вторая акушерка Пелагея Ивановна чокнулась, хлебнула, сейчас же присела на корточки и кочергой пошевелила в печке.	Михаил Булгаков. Тьма египетская.	http://az.lib.ru/b/bulgakow_m_a/text_04_1925_tma_egipetskaya.shtml
 Жаркий блеск метнулся по нашим лицам, в груди теплело от водки.	Михаил Булгаков. Тьма египетская.	http://az.lib.ru/b/bulgakow_m_a/text_04_1925_tma_egipetskaya.shtml
 — Я решительно не постигаю, — заговорил я возбужденно и глядя на тучу искр, взметнувшихся под кочергой, — что эта баба сделала с белладонной.	Михаил Булгаков. Тьма египетская.	http://az.lib.ru/b/bulgakow_m_a/text_04_1925_tma_egipetskaya.shtml
 Ведь это же кошмар!	Михаил Булгаков. Тьма египетская.	http://az.lib.ru/b/bulgakow_m_a/text_04_1925_tma_egipetskaya.shtml
 Улыбки заиграли на лицах фельдшера и акушерок.	Михаил Булгаков. Тьма египетская.	http://az.lib.ru/b/bulgakow_m_a/text_04_1925_tma_egipetskaya.shtml
 Дело было вот в чем.	Михаил Булгаков. Тьма египетская.	http://az.lib.ru/b/bulgakow_m_a/text_04_1925_tma_egipetskaya.shtml
 Сегодня на утреннем приеме в кабинет ко мне протиснулась румяная бабочка лет тридцати.	Михаил Булгаков. Тьма египетская.	http://az.lib.ru/b/bulgakow_m_a/text_04_1925_tma_egipetskaya.shtml
