sentence	name	link
 С четверть часа я так провел, и вывел меня из забытья, в котором неотступно всплывало перед закрытыми глазами рябое лицо, под золотыми галунами, голос моего конвоира: — Пан полковник вас требует.	Михаил Булгаков. Я убил.	http://az.lib.ru/b/bulgakow_m_a/text_08_1925_ya_ubil.shtml
 Я поднялся, под изумленным взором конвоира размотал башлык и пошел вслед за кавалеристом.	Михаил Булгаков. Я убил.	http://az.lib.ru/b/bulgakow_m_a/text_08_1925_ya_ubil.shtml
 Мы спустились по лестнице в нижний этаж, и я вошел в белую комнату.	Михаил Булгаков. Я убил.	http://az.lib.ru/b/bulgakow_m_a/text_08_1925_ya_ubil.shtml
 Тут я увидал полковника Лещенко в свете фонаря.	Михаил Булгаков. Я убил.	http://az.lib.ru/b/bulgakow_m_a/text_08_1925_ya_ubil.shtml
 Он был обнажен до пояса и ежился на табурете, прижимая к груди окровавленную марлю.	Михаил Булгаков. Я убил.	http://az.lib.ru/b/bulgakow_m_a/text_08_1925_ya_ubil.shtml
 Возле него стоял растерянный хлопец и топтался, похлопывая шпорами.	Михаил Булгаков. Я убил.	http://az.lib.ru/b/bulgakow_m_a/text_08_1925_ya_ubil.shtml
 — Сволочь, — процедил полковник, потом обратился ко мне: — Ну, пан ликарь, перевязывайте меня.	Михаил Булгаков. Я убил.	http://az.lib.ru/b/bulgakow_m_a/text_08_1925_ya_ubil.shtml
 Хлопец, выйди, — приказал он хлопцу, и тот, громыхая, протискался в дверь.	Михаил Булгаков. Я убил.	http://az.lib.ru/b/bulgakow_m_a/text_08_1925_ya_ubil.shtml
 В доме было тихо.	Михаил Булгаков. Я убил.	http://az.lib.ru/b/bulgakow_m_a/text_08_1925_ya_ubil.shtml
 И в этот момент рама в окне дрогнула.	Михаил Булгаков. Я убил.	http://az.lib.ru/b/bulgakow_m_a/text_08_1925_ya_ubil.shtml
 Полковник покосился на черное окно, я тоже.	Михаил Булгаков. Я убил.	http://az.lib.ru/b/bulgakow_m_a/text_08_1925_ya_ubil.shtml
" ""Орудия"", — подумал я, вздохнул судорожно, спросил: — От чего это?"	Михаил Булгаков. Я убил.	http://az.lib.ru/b/bulgakow_m_a/text_08_1925_ya_ubil.shtml
 — Перочинным ножом, — ответил полковник хмуро.	Михаил Булгаков. Я убил.	http://az.lib.ru/b/bulgakow_m_a/text_08_1925_ya_ubil.shtml
 — Кто?	Михаил Булгаков. Я убил.	http://az.lib.ru/b/bulgakow_m_a/text_08_1925_ya_ubil.shtml
 — Не ваше дело, — отозвался он с холодным, злобным презрением и добавил: — Ой, пан ликарь, не хорошо вам будет.	Михаил Булгаков. Я убил.	http://az.lib.ru/b/bulgakow_m_a/text_08_1925_ya_ubil.shtml
" Меня вдруг осенило: ""Кто кто-то не выдержал его истязаний, бросился на него и ранил."	Михаил Булгаков. Я убил.	http://az.lib.ru/b/bulgakow_m_a/text_08_1925_ya_ubil.shtml
" Только так и может быть..."" — Снимите марлю, — сказал я, наклоняясь к его груди, поросшей черным волосом."	Михаил Булгаков. Я убил.	http://az.lib.ru/b/bulgakow_m_a/text_08_1925_ya_ubil.shtml
 Но он не успел отнять кровавый комочек, как за дверью послышался топот, возня, грубый голос закричал: — Стой, стой, черт, куда...	Михаил Булгаков. Я убил.	http://az.lib.ru/b/bulgakow_m_a/text_08_1925_ya_ubil.shtml
 Дверь распахнулась, и ворвалась растрепанная женщина.	Михаил Булгаков. Я убил.	http://az.lib.ru/b/bulgakow_m_a/text_08_1925_ya_ubil.shtml
 Лицо ее было сухо и, как мне показалось, даже весело.	Михаил Булгаков. Я убил.	http://az.lib.ru/b/bulgakow_m_a/text_08_1925_ya_ubil.shtml
 Лишь после, много времени спустя, я сообразил, что крайнее исступление может выражаться в очень странных формах.	Михаил Булгаков. Я убил.	http://az.lib.ru/b/bulgakow_m_a/text_08_1925_ya_ubil.shtml
 Серая рука хотела поймать женщину за платок, но сорвалась.	Михаил Булгаков. Я убил.	http://az.lib.ru/b/bulgakow_m_a/text_08_1925_ya_ubil.shtml
 — Уйди, хлопец, уйди, — приказал полковник, и рука исчезла.	Михаил Булгаков. Я убил.	http://az.lib.ru/b/bulgakow_m_a/text_08_1925_ya_ubil.shtml
 Женщина остановила взор на обнаженном полковнике и сказала сухим бесслезным голосом: — За что мужа расстреляли?	Михаил Булгаков. Я убил.	http://az.lib.ru/b/bulgakow_m_a/text_08_1925_ya_ubil.shtml
 — За що треба, за то и расстреляли, — отозвался полковник и страдальчески сморщился.	Михаил Булгаков. Я убил.	http://az.lib.ru/b/bulgakow_m_a/text_08_1925_ya_ubil.shtml
 Комочек все больше алел под его пальцами.	Михаил Булгаков. Я убил.	http://az.lib.ru/b/bulgakow_m_a/text_08_1925_ya_ubil.shtml
 Она усмехнулась так, что я стал не отрываясь глядеть ей в глаза.	Михаил Булгаков. Я убил.	http://az.lib.ru/b/bulgakow_m_a/text_08_1925_ya_ubil.shtml
 Не видел таких глаз.	Михаил Булгаков. Я убил.	http://az.lib.ru/b/bulgakow_m_a/text_08_1925_ya_ubil.shtml
 И вот она повернулась ко мне и сказала: — А вы доктор!..	Михаил Булгаков. Я убил.	http://az.lib.ru/b/bulgakow_m_a/text_08_1925_ya_ubil.shtml
 Ткнула пальцем в рукав, в красный крест и покачала головой.	Михаил Булгаков. Я убил.	http://az.lib.ru/b/bulgakow_m_a/text_08_1925_ya_ubil.shtml
 — Ай, ай, — продолжала она, и глаза ее пылали, — ай, ай.	Михаил Булгаков. Я убил.	http://az.lib.ru/b/bulgakow_m_a/text_08_1925_ya_ubil.shtml
 Какой вы подлец... вы в университете обучались и с этой рванью...	Михаил Булгаков. Я убил.	http://az.lib.ru/b/bulgakow_m_a/text_08_1925_ya_ubil.shtml
 На их стороне и перевязочки делаете?!	Михаил Булгаков. Я убил.	http://az.lib.ru/b/bulgakow_m_a/text_08_1925_ya_ubil.shtml
 Он человека по лицу лупит и лупит.	Михаил Булгаков. Я убил.	http://az.lib.ru/b/bulgakow_m_a/text_08_1925_ya_ubil.shtml
 Пока с ума не свел...	Михаил Булгаков. Я убил.	http://az.lib.ru/b/bulgakow_m_a/text_08_1925_ya_ubil.shtml
 А вы ему перевязочку делаете?..	Михаил Булгаков. Я убил.	http://az.lib.ru/b/bulgakow_m_a/text_08_1925_ya_ubil.shtml
 Все у меня помутилось перед глазами, даже до тошноты, и я почувствовал, что сейчас вот и начались самые страшные и удивительные события в моей злосчастной докторской жизни.	Михаил Булгаков. Я убил.	http://az.lib.ru/b/bulgakow_m_a/text_08_1925_ya_ubil.shtml
 — Вы мне говорите? — спросил я и почувствовал, что дрожу.	Михаил Булгаков. Я убил.	http://az.lib.ru/b/bulgakow_m_a/text_08_1925_ya_ubil.shtml
 — Мне?..	Михаил Булгаков. Я убил.	http://az.lib.ru/b/bulgakow_m_a/text_08_1925_ya_ubil.shtml
 Да вы знаете...	Михаил Булгаков. Я убил.	http://az.lib.ru/b/bulgakow_m_a/text_08_1925_ya_ubil.shtml
 Но она не пожелала слушать, повернулась к полковнику и плюнула ему в лицо.	Михаил Булгаков. Я убил.	http://az.lib.ru/b/bulgakow_m_a/text_08_1925_ya_ubil.shtml
 Тот вскочил, крикнул: — Хлопцы!	Михаил Булгаков. Я убил.	http://az.lib.ru/b/bulgakow_m_a/text_08_1925_ya_ubil.shtml
 Когда ворвались, он сказал гневно.	Михаил Булгаков. Я убил.	http://az.lib.ru/b/bulgakow_m_a/text_08_1925_ya_ubil.shtml
 — Дайте ей двадцать пять шомполов.	Михаил Булгаков. Я убил.	http://az.lib.ru/b/bulgakow_m_a/text_08_1925_ya_ubil.shtml
 Она ничего не сказала, и ее выволокли под руки, а полковник закрыл дверь и забросил крючок, потом опустился на табурет и отбросил ком марли.	Михаил Булгаков. Я убил.	http://az.lib.ru/b/bulgakow_m_a/text_08_1925_ya_ubil.shtml
 Из небольшого пореза сочилась кровь.	Михаил Булгаков. Я убил.	http://az.lib.ru/b/bulgakow_m_a/text_08_1925_ya_ubil.shtml
 Полковник вытер плевок, повисший на правом усе.	Михаил Булгаков. Я убил.	http://az.lib.ru/b/bulgakow_m_a/text_08_1925_ya_ubil.shtml
 — Женщину? — спросил я совершенно чужим голосом.	Михаил Булгаков. Я убил.	http://az.lib.ru/b/bulgakow_m_a/text_08_1925_ya_ubil.shtml
 Гнев загорелся в его глазах.	Михаил Булгаков. Я убил.	http://az.lib.ru/b/bulgakow_m_a/text_08_1925_ya_ubil.shtml
 — Эге-ге... — сказал он и глянул зловеще на меня.	Михаил Булгаков. Я убил.	http://az.lib.ru/b/bulgakow_m_a/text_08_1925_ya_ubil.shtml
 Теперь я вижу, якую птицу мне дали вместо ликаря...	Михаил Булгаков. Я убил.	http://az.lib.ru/b/bulgakow_m_a/text_08_1925_ya_ubil.shtml
 ............................................	Михаил Булгаков. Я убил.	http://az.lib.ru/b/bulgakow_m_a/text_08_1925_ya_ubil.shtml
 Одну из пуль я, по-видимому, вогнал ему в рот, потому что помню, что он качался на табурете и кровь у него бежала изо рта, потом сразу выросли потеки на груди и животе, потом его глаза угасли и стали молочными из черных, затем он рухнул на пол.	Михаил Булгаков. Я убил.	http://az.lib.ru/b/bulgakow_m_a/text_08_1925_ya_ubil.shtml
 Стреляя, я, помнится, боялся ошибиться в счете и выпустить седьмую, последнюю.	Михаил Булгаков. Я убил.	http://az.lib.ru/b/bulgakow_m_a/text_08_1925_ya_ubil.shtml
" ""Вот и моя смерть"", — думал я, и очень приятно пахло дымным газом от браунинга."	Михаил Булгаков. Я убил.	http://az.lib.ru/b/bulgakow_m_a/text_08_1925_ya_ubil.shtml
 Дверь лишь только затрещала, я выбросился в окно, выбив стекла ногами.	Михаил Булгаков. Я убил.	http://az.lib.ru/b/bulgakow_m_a/text_08_1925_ya_ubil.shtml
 И выскочил, судьба меня побаловала, в глухой двор, пробежал мимо штабелей дров в черную улицу.	Михаил Булгаков. Я убил.	http://az.lib.ru/b/bulgakow_m_a/text_08_1925_ya_ubil.shtml
 Меня бы обязательно схватили, но я случайно налетел на провал между двумя вплотную подходившими друг к другу стенами и там, в выбоине, как в пещере, на битом кирпиче просидел несколько часов.	Михаил Булгаков. Я убил.	http://az.lib.ru/b/bulgakow_m_a/text_08_1925_ya_ubil.shtml
 Конные проскакали мимо меня, я это слышал.	Михаил Булгаков. Я убил.	http://az.lib.ru/b/bulgakow_m_a/text_08_1925_ya_ubil.shtml
 Улочка вела к Днепру, и они долго рыскали по реке, искали меня.	Михаил Булгаков. Я убил.	http://az.lib.ru/b/bulgakow_m_a/text_08_1925_ya_ubil.shtml
 В трещину я видел одну звезду, почему-то думаю, что это был Марс.	Михаил Булгаков. Я убил.	http://az.lib.ru/b/bulgakow_m_a/text_08_1925_ya_ubil.shtml
 Мне показалось, что ее разорвало.	Михаил Булгаков. Я убил.	http://az.lib.ru/b/bulgakow_m_a/text_08_1925_ya_ubil.shtml
 Это первый снаряд лопнул, закрыл звезду.	Михаил Булгаков. Я убил.	http://az.lib.ru/b/bulgakow_m_a/text_08_1925_ya_ubil.shtml
 И потом всю ночь грохотало по Слободке и било, а я сидел в кирпичной норе и молчал и думал об ученой степени и о том, умерла ли эта женщина под шомполами.	Михаил Булгаков. Я убил.	http://az.lib.ru/b/bulgakow_m_a/text_08_1925_ya_ubil.shtml
 А когда стихло, чуть-чуть светало и я вышел из выбоины, не вытерпев пытки, — я отморозил ноги.	Михаил Булгаков. Я убил.	http://az.lib.ru/b/bulgakow_m_a/text_08_1925_ya_ubil.shtml
 Слободка умерла, все молчало, звезды побледнели.	Михаил Булгаков. Я убил.	http://az.lib.ru/b/bulgakow_m_a/text_08_1925_ya_ubil.shtml
 И когда я пришел к мосту, не было как будто никогда ни полковника Лещенко, ни конного полка...	Михаил Булгаков. Я убил.	http://az.lib.ru/b/bulgakow_m_a/text_08_1925_ya_ubil.shtml
 Только навоз на истоптанной дороге...	Михаил Булгаков. Я убил.	http://az.lib.ru/b/bulgakow_m_a/text_08_1925_ya_ubil.shtml
 И я один прошел весь путь к Киеву и вошел в него, когда совсем рассвело.	Михаил Булгаков. Я убил.	http://az.lib.ru/b/bulgakow_m_a/text_08_1925_ya_ubil.shtml
 Меня встретил странный патруль, В каких-то шапках с наушниками.	Михаил Булгаков. Я убил.	http://az.lib.ru/b/bulgakow_m_a/text_08_1925_ya_ubil.shtml
 Меня остановили, спросили документы.	Михаил Булгаков. Я убил.	http://az.lib.ru/b/bulgakow_m_a/text_08_1925_ya_ubil.shtml
 Я сказал: — Я лекарь Яшвин.	Михаил Булгаков. Я убил.	http://az.lib.ru/b/bulgakow_m_a/text_08_1925_ya_ubil.shtml
 Бегу от петлюровцев.	Михаил Булгаков. Я убил.	http://az.lib.ru/b/bulgakow_m_a/text_08_1925_ya_ubil.shtml
 Где они?	Михаил Булгаков. Я убил.	http://az.lib.ru/b/bulgakow_m_a/text_08_1925_ya_ubil.shtml
 Мне сказали: — Ночью ушли.	Михаил Булгаков. Я убил.	http://az.lib.ru/b/bulgakow_m_a/text_08_1925_ya_ubil.shtml
 В Киеве ревком.	Михаил Булгаков. Я убил.	http://az.lib.ru/b/bulgakow_m_a/text_08_1925_ya_ubil.shtml
 И вижу, один из патрульных всматривается мне в глаза, потом как-то жалостливо махнул рукой и говорит: — Идите, доктор, домой.	Михаил Булгаков. Я убил.	http://az.lib.ru/b/bulgakow_m_a/text_08_1925_ya_ubil.shtml
 И я пошел.	Михаил Булгаков. Я убил.	http://az.lib.ru/b/bulgakow_m_a/text_08_1925_ya_ubil.shtml
 После молчания я спросил у Яшвина: — Он умер?	Михаил Булгаков. Я убил.	http://az.lib.ru/b/bulgakow_m_a/text_08_1925_ya_ubil.shtml
 Убили вы его или только ранили?	Михаил Булгаков. Я убил.	http://az.lib.ru/b/bulgakow_m_a/text_08_1925_ya_ubil.shtml
 Яшвин ответил, улыбаясь своей странненькой улыбкой: — О, будьте покойны.	Михаил Булгаков. Я убил.	http://az.lib.ru/b/bulgakow_m_a/text_08_1925_ya_ubil.shtml
 Я убил.	Михаил Булгаков. Я убил.	http://az.lib.ru/b/bulgakow_m_a/text_08_1925_ya_ubil.shtml
 Поверьте моему хирургическому опыту.	Михаил Булгаков. Я убил.	http://az.lib.ru/b/bulgakow_m_a/text_08_1925_ya_ubil.shtml
 Давно уже отмечено умными людьми, что счастье как здоровье: когда оно налицо, его не замечаешь.	Михаил Булгаков. Морфий.	http://az.lib.ru/b/bulgakow_m_a/text_09_1927_morfiy.shtml
 Но когда пройдут годы, — как вспоминаешь о счастье, о, как вспоминаешь!	Михаил Булгаков. Морфий.	http://az.lib.ru/b/bulgakow_m_a/text_09_1927_morfiy.shtml
 Что касается меня, то я, как выяснилось это теперь, был счастлив в 1917 году, зимой.	Михаил Булгаков. Морфий.	http://az.lib.ru/b/bulgakow_m_a/text_09_1927_morfiy.shtml
 Незабываемый, вьюжный, стремительный год.	Михаил Булгаков. Морфий.	http://az.lib.ru/b/bulgakow_m_a/text_09_1927_morfiy.shtml
 Начавшаяся вьюга подхватила меня, как клочок изорванной газеты, и перенесла с глухого участка в уездный город.	Михаил Булгаков. Морфий.	http://az.lib.ru/b/bulgakow_m_a/text_09_1927_morfiy.shtml
 Велика штука, подумаешь, уездный город?	Михаил Булгаков. Морфий.	http://az.lib.ru/b/bulgakow_m_a/text_09_1927_morfiy.shtml
 Но если кто-нибудь подобно мне просидел в снегу зимой, в строгих и бедных лесах летом, полтора года, не отлучаясь ни на один день, если кто-нибудь разрывал бандероль на газете от прошлой недели с таким сердечным биением, точно счастливый любовник голубой конверт, ежели кто-нибудь ездил на роды за 18 верcт в санях, запряженных гуськом, тот, надо полагать, поймет меня.	Михаил Булгаков. Морфий.	http://az.lib.ru/b/bulgakow_m_a/text_09_1927_morfiy.shtml
 Уютнейшая вещь керосиновая лампа, но я за электричество!	Михаил Булгаков. Морфий.	http://az.lib.ru/b/bulgakow_m_a/text_09_1927_morfiy.shtml
 И вот я увидел их вновь, наконец, обольстительные электрические лампочки и главная улица городка, хорошо укатанная крестьянскими санями, улица, на которой, чаруя взор, висели — вывеска с сапогами, золотой крендель, изображение молодого человека со свиными наглыми глазками и с абсолютно неестественной прической, означавшей, что за стеклянными дверями помещается местный Базиль, за 30 копеек бравшийся вас брить во всякое время, за исключением дней праздничных, коими изобилует отечество мое.	Михаил Булгаков. Морфий.	http://az.lib.ru/b/bulgakow_m_a/text_09_1927_morfiy.shtml
 До сих пор с дрожью вспоминаю салфетки Базиля, салфетки, заставлявшие неотступно представлять себе ту страницу в германском учебнике кожных болезней, на которой с убедительной ясностью изображен твердый шанкр на подбородке у какого-то гражданина.	Михаил Булгаков. Морфий.	http://az.lib.ru/b/bulgakow_m_a/text_09_1927_morfiy.shtml
 Но и салфетки эти все же не омрачат моих воспоминаний!	Михаил Булгаков. Морфий.	http://az.lib.ru/b/bulgakow_m_a/text_09_1927_morfiy.shtml
 На перекрестке стоял живой милиционер, в запыленной витрине смутно виднелись железные листы с тесными рядами пирожных с рыжим кремом, сено устилало площадь, и шли, и ехали, и разговаривали, в будке торговали вчерашними московскими газетами, содержащими в себе потрясающие известия, невдалеке призывно пересвистывались московские поезда.	Михаил Булгаков. Морфий.	http://az.lib.ru/b/bulgakow_m_a/text_09_1927_morfiy.shtml
 Словом, это была цивилизация, Вавилон, Невский проспект.	Михаил Булгаков. Морфий.	http://az.lib.ru/b/bulgakow_m_a/text_09_1927_morfiy.shtml
 О больнице и говорить не приходится.	Михаил Булгаков. Морфий.	http://az.lib.ru/b/bulgakow_m_a/text_09_1927_morfiy.shtml
 В ней было хирургическое отделение, терапевтическое, заразное, акушерское.	Михаил Булгаков. Морфий.	http://az.lib.ru/b/bulgakow_m_a/text_09_1927_morfiy.shtml
 В больнице была операционная, в ней сиял автоклав, серебрились краны, столы раскрывали свои хитрые лапы, зубья, винты.	Михаил Булгаков. Морфий.	http://az.lib.ru/b/bulgakow_m_a/text_09_1927_morfiy.shtml
 В больнице был старший врач, три ординатора (кроме меня).	Михаил Булгаков. Морфий.	http://az.lib.ru/b/bulgakow_m_a/text_09_1927_morfiy.shtml
 Фельдшера, акушерки, сиделка, аптека и лаборатория.	Михаил Булгаков. Морфий.	http://az.lib.ru/b/bulgakow_m_a/text_09_1927_morfiy.shtml
 Лаборатория, подумать только!	Михаил Булгаков. Морфий.	http://az.lib.ru/b/bulgakow_m_a/text_09_1927_morfiy.shtml
 С цейсовским микроскопом, прекрасным запасом красок.	Михаил Булгаков. Морфий.	http://az.lib.ru/b/bulgakow_m_a/text_09_1927_morfiy.shtml
 Я вздрагивал и холодел, меня давили впечатления.	Михаил Булгаков. Морфий.	http://az.lib.ru/b/bulgakow_m_a/text_09_1927_morfiy.shtml
 Немало дней прошло, пока я не привык к тому, что одноэтажные корпуса больницы в декабрьские сумерки, словно по команде, загорались электрическим светом.	Михаил Булгаков. Морфий.	http://az.lib.ru/b/bulgakow_m_a/text_09_1927_morfiy.shtml
 Он слепил меня.	Михаил Булгаков. Морфий.	http://az.lib.ru/b/bulgakow_m_a/text_09_1927_morfiy.shtml
 В ваннах бушевала и гремела вода, и деревянные измызганные термометры ныряли и плавали в них.	Михаил Булгаков. Морфий.	http://az.lib.ru/b/bulgakow_m_a/text_09_1927_morfiy.shtml
