sentence	name	link
 Если человек не ездил на лошадях по глухим проселочным дорогам, то рассказывать мне ему об этом нечего: все равно он не поймет.	Михаил Булгаков. Полотенце с петухом.	http://az.lib.ru/b/bulgakow_m_a/text_01_1926_polotentze_s_petuhom.shtml
 А тому, кто ездил, и напоминать не хочу.	Михаил Булгаков. Полотенце с петухом.	http://az.lib.ru/b/bulgakow_m_a/text_01_1926_polotentze_s_petuhom.shtml
 Скажу коротко: сорок верст, отделяющих уездный город Грачевку от Мурьевской больницы, ехали мы с возницей моим ровно сутки.	Михаил Булгаков. Полотенце с петухом.	http://az.lib.ru/b/bulgakow_m_a/text_01_1926_polotentze_s_petuhom.shtml
 И даже до курьезного ровно: в два часа дня 16 сентября 1917 года мы были у последнего лабаза, помещающегося на границе этого замечательного города Грачевки, а в два часа пять минут 17 сентября того же 17-го незабываемого года я стоял на битой, умирающей и смякшей от сентябрьского дождика траве во дворе Мурьевской больницы.	Михаил Булгаков. Полотенце с петухом.	http://az.lib.ru/b/bulgakow_m_a/text_01_1926_polotentze_s_petuhom.shtml
 Стоял я в таком виде: ноги окостенели, и настолько, что я смутно тут же во дворе мысленно перелистывал страницы учебников, тупо стараясь припомнить, существует ли действительно, или мне это померещилось во вчерашнем сне в деревне Грабиловке, болезнь, при которой у человека окостеневают мышцы?	Михаил Булгаков. Полотенце с петухом.	http://az.lib.ru/b/bulgakow_m_a/text_01_1926_polotentze_s_petuhom.shtml
 Как ее, проклятую, зовут по-латыни?	Михаил Булгаков. Полотенце с петухом.	http://az.lib.ru/b/bulgakow_m_a/text_01_1926_polotentze_s_petuhom.shtml
 Каждая из мышц этих болела нестерпимой болью, напоминающей зубную боль.	Михаил Булгаков. Полотенце с петухом.	http://az.lib.ru/b/bulgakow_m_a/text_01_1926_polotentze_s_petuhom.shtml
 О пальцах на ног говорить не приходится — они уже не шевелились в сапогах, лежали смирно, были похожи на деревянные культяпки.	Михаил Булгаков. Полотенце с петухом.	http://az.lib.ru/b/bulgakow_m_a/text_01_1926_polotentze_s_petuhom.shtml
 Сознаюсь, что в порыве малодушия я проклинал шепотом медицину и свое заявление, поданное пять лет тому назад ректору университета.	Михаил Булгаков. Полотенце с петухом.	http://az.lib.ru/b/bulgakow_m_a/text_01_1926_polotentze_s_petuhom.shtml
 Сверху в это время сеяло, как сквозь сито.	Михаил Булгаков. Полотенце с петухом.	http://az.lib.ru/b/bulgakow_m_a/text_01_1926_polotentze_s_petuhom.shtml
 Пальто мое набухло, как губка.	Михаил Булгаков. Полотенце с петухом.	http://az.lib.ru/b/bulgakow_m_a/text_01_1926_polotentze_s_petuhom.shtml
 Пальцами правой руки я тщетно пытался ухватиться за ручку чемодана и наконец плюнул на мокрую траву.	Михаил Булгаков. Полотенце с петухом.	http://az.lib.ru/b/bulgakow_m_a/text_01_1926_polotentze_s_petuhom.shtml
" Пальцы мои ничего не могли хватать, и опять мне, начиненному всякими знаниями из интересных медицинских книжек, вспомнилась болезнь — паралич ""Парализис"", — отчаянно мысленно и черт знает зачем сказал я себе."	Михаил Булгаков. Полотенце с петухом.	http://az.lib.ru/b/bulgakow_m_a/text_01_1926_polotentze_s_petuhom.shtml
 — П... по вашим дорогам, — заговорил я деревянными, синенькими губами, — нужно п...	Михаил Булгаков. Полотенце с петухом.	http://az.lib.ru/b/bulgakow_m_a/text_01_1926_polotentze_s_petuhom.shtml
 И при этом злобно почему-то уставился на возницу, хотя он, собственно, и не был виноват в такой дороге.	Михаил Булгаков. Полотенце с петухом.	http://az.lib.ru/b/bulgakow_m_a/text_01_1926_polotentze_s_petuhom.shtml
 — Эх... товарищ доктор, — отозвался возница, тоже еле шевеля губами под светлыми усишками, — пятнадцать годов езжу, а все привыкнуть не могу.	Михаил Булгаков. Полотенце с петухом.	http://az.lib.ru/b/bulgakow_m_a/text_01_1926_polotentze_s_petuhom.shtml
 Я содрогнулся, оглянулся тоскливо на белый облупленный двухэтажный корпус, на небеленые бревенчатые стены фельдшерского домика, на свою будущую резиденцию — двухэтажный, очень чистенький дом с гробовыми загадочными окнами, протяжно вздохнул.	Михаил Булгаков. Полотенце с петухом.	http://az.lib.ru/b/bulgakow_m_a/text_01_1926_polotentze_s_petuhom.shtml
" И тут же мутно мелькнула в голове вместо латинских слов сладкая фраза, которую спел в ошалевших от качки мозгах полный тенор с голубыми ляжками: — ""Привет тебе... при-ют свя-щенный..."" Прощай, прощай надолго, золото-красный Большой театр, Москва, витрины..."	Михаил Булгаков. Полотенце с петухом.	http://az.lib.ru/b/bulgakow_m_a/text_01_1926_polotentze_s_petuhom.shtml
" ""Я тулуп буду в следующий раз надевать... — в злобном отчаянии думал я и рвал чемодан за ремни негнущимися руками, — я..."	Михаил Булгаков. Полотенце с петухом.	http://az.lib.ru/b/bulgakow_m_a/text_01_1926_polotentze_s_petuhom.shtml
 А раньше чем через месяц я не поеду, не поеду в Грачевку...	Михаил Булгаков. Полотенце с петухом.	http://az.lib.ru/b/bulgakow_m_a/text_01_1926_polotentze_s_petuhom.shtml
 Подумайте сами... ведь ночевать пришлось!	Михаил Булгаков. Полотенце с петухом.	http://az.lib.ru/b/bulgakow_m_a/text_01_1926_polotentze_s_petuhom.shtml
 Двадцать верст сделали и оказались в могильной тьме... ночь...	Михаил Булгаков. Полотенце с петухом.	http://az.lib.ru/b/bulgakow_m_a/text_01_1926_polotentze_s_petuhom.shtml
 А сегодня утром выехали в семь утра...	Михаил Булгаков. Полотенце с петухом.	http://az.lib.ru/b/bulgakow_m_a/text_01_1926_polotentze_s_petuhom.shtml
 И вот едешь... батюшки-с-светы...	Михаил Булгаков. Полотенце с петухом.	http://az.lib.ru/b/bulgakow_m_a/text_01_1926_polotentze_s_petuhom.shtml
 Одно колесо ухает в яму, другое на воздух подымается, чемодан на ноги — бух... потом на бок, потом на другой, потом носом вперед, потом затылком.	Михаил Булгаков. Полотенце с петухом.	http://az.lib.ru/b/bulgakow_m_a/text_01_1926_polotentze_s_petuhom.shtml
 А сверху сеет и сеет, и стынут кости.	Михаил Булгаков. Полотенце с петухом.	http://az.lib.ru/b/bulgakow_m_a/text_01_1926_polotentze_s_petuhom.shtml
 Да разве я мог бы поверить, что в середине серенького кислого сентября человек может мерзнуть в поле, как в лютую зиму?!	Михаил Булгаков. Полотенце с петухом.	http://az.lib.ru/b/bulgakow_m_a/text_01_1926_polotentze_s_petuhom.shtml
 Ан, оказывается, может.	Михаил Булгаков. Полотенце с петухом.	http://az.lib.ru/b/bulgakow_m_a/text_01_1926_polotentze_s_petuhom.shtml
 И пока умираешь медленною смертью, валишь одно и то же, одно.	Михаил Булгаков. Полотенце с петухом.	http://az.lib.ru/b/bulgakow_m_a/text_01_1926_polotentze_s_petuhom.shtml
 Справа горбатое обглоданное поле, слева чахлый перелесок, а возле него серые драные избы, штук пять и шесть.	Михаил Булгаков. Полотенце с петухом.	http://az.lib.ru/b/bulgakow_m_a/text_01_1926_polotentze_s_petuhom.shtml
 И кажется, что в них нет ни одной живой души.	Михаил Булгаков. Полотенце с петухом.	http://az.lib.ru/b/bulgakow_m_a/text_01_1926_polotentze_s_petuhom.shtml
" Молчание, молчание кругом""."	Михаил Булгаков. Полотенце с петухом.	http://az.lib.ru/b/bulgakow_m_a/text_01_1926_polotentze_s_petuhom.shtml
 Чемодан наконец поддался.	Михаил Булгаков. Полотенце с петухом.	http://az.lib.ru/b/bulgakow_m_a/text_01_1926_polotentze_s_petuhom.shtml
 Возница налег на него животом и выпихнул его прямо на меня.	Михаил Булгаков. Полотенце с петухом.	http://az.lib.ru/b/bulgakow_m_a/text_01_1926_polotentze_s_petuhom.shtml
 Я хотел удержать его за ремень, но рука отказалась работать, и распухший, осточертевший мой спутник с книжками и всяким барахлом плюхнулся прямо на траву, шарахнув меня по ногам.	Михаил Булгаков. Полотенце с петухом.	http://az.lib.ru/b/bulgakow_m_a/text_01_1926_polotentze_s_petuhom.shtml
 — Эх ты, Госпо... — начал возница испуганно, но я никаких претензий не предъявлял — ноги у меня были все равно хоть выбрось их.	Михаил Булгаков. Полотенце с петухом.	http://az.lib.ru/b/bulgakow_m_a/text_01_1926_polotentze_s_petuhom.shtml
 — Эй, кто тут?	Михаил Булгаков. Полотенце с петухом.	http://az.lib.ru/b/bulgakow_m_a/text_01_1926_polotentze_s_petuhom.shtml
 Эй! — закричал возница и захлопал руками, как петух крыльями.	Михаил Булгаков. Полотенце с петухом.	http://az.lib.ru/b/bulgakow_m_a/text_01_1926_polotentze_s_petuhom.shtml
 — Эй, доктора привез!	Михаил Булгаков. Полотенце с петухом.	http://az.lib.ru/b/bulgakow_m_a/text_01_1926_polotentze_s_petuhom.shtml
 Тут в темных стеклах фельдшерского домика показались лица, прилипли к ним, хлопнула дверь, и вот я увидел, как заковылял по траве ко мне человек в рваненьком пальтишке и сапожишках.	Михаил Булгаков. Полотенце с петухом.	http://az.lib.ru/b/bulgakow_m_a/text_01_1926_polotentze_s_petuhom.shtml
 Он почтительно и торопливо снял картуз, подбежал на два шага ко мне, почему-то улыбнулся стыдливо и хриплым голоском приветствовал меня: — Здравствуйте, товарищ доктор.	Михаил Булгаков. Полотенце с петухом.	http://az.lib.ru/b/bulgakow_m_a/text_01_1926_polotentze_s_petuhom.shtml
 — Кто вы такой? — спросил я.	Михаил Булгаков. Полотенце с петухом.	http://az.lib.ru/b/bulgakow_m_a/text_01_1926_polotentze_s_petuhom.shtml
 — Егорыч я, — отрекомендовался человек, — сторож здешний.	Михаил Булгаков. Полотенце с петухом.	http://az.lib.ru/b/bulgakow_m_a/text_01_1926_polotentze_s_petuhom.shtml
 Уж мы вас ждем, ждем...	Михаил Булгаков. Полотенце с петухом.	http://az.lib.ru/b/bulgakow_m_a/text_01_1926_polotentze_s_petuhom.shtml
 И тут же он ухватился за чемодан, вскинул его на плечо и понес.	Михаил Булгаков. Полотенце с петухом.	http://az.lib.ru/b/bulgakow_m_a/text_01_1926_polotentze_s_petuhom.shtml
 Я захромал за ним, безуспешно пытаясь всунуть руку в карман брюк, чтобы вынуть портмоне.	Михаил Булгаков. Полотенце с петухом.	http://az.lib.ru/b/bulgakow_m_a/text_01_1926_polotentze_s_petuhom.shtml
 Человеку, в сущности, очень немного нужно.	Михаил Булгаков. Полотенце с петухом.	http://az.lib.ru/b/bulgakow_m_a/text_01_1926_polotentze_s_petuhom.shtml
 И прежде всего ему нужен огонь.	Михаил Булгаков. Полотенце с петухом.	http://az.lib.ru/b/bulgakow_m_a/text_01_1926_polotentze_s_petuhom.shtml
 Направляясь в мурьевскую глушь, я, помнится, еще в Москве давал себе слово держать себя солидно.	Михаил Булгаков. Полотенце с петухом.	http://az.lib.ru/b/bulgakow_m_a/text_01_1926_polotentze_s_petuhom.shtml
 Мой юный вид отравлял мне существование на первых шагах.	Михаил Булгаков. Полотенце с петухом.	http://az.lib.ru/b/bulgakow_m_a/text_01_1926_polotentze_s_petuhom.shtml
 Каждому приходилось представляться: — Доктор такой-то.	Михаил Булгаков. Полотенце с петухом.	http://az.lib.ru/b/bulgakow_m_a/text_01_1926_polotentze_s_petuhom.shtml
 И каждый обязательно поднимал брови и спрашивал: — Неужели?	Михаил Булгаков. Полотенце с петухом.	http://az.lib.ru/b/bulgakow_m_a/text_01_1926_polotentze_s_petuhom.shtml
 А я-то думал, что вы еще студент.	Михаил Булгаков. Полотенце с петухом.	http://az.lib.ru/b/bulgakow_m_a/text_01_1926_polotentze_s_petuhom.shtml
" — Нет, я кончил, — хмуро отвечал я и думал ""очки мне нужно завести, вот что""."	Михаил Булгаков. Полотенце с петухом.	http://az.lib.ru/b/bulgakow_m_a/text_01_1926_polotentze_s_petuhom.shtml
 Но очки было заводить не к чему, глаза у меня были здоровые, и ясность их еще не была омрачена житейским опытом.	Михаил Булгаков. Полотенце с петухом.	http://az.lib.ru/b/bulgakow_m_a/text_01_1926_polotentze_s_petuhom.shtml
 Не имея возможности защищаться от всегдашних снисходительных и ласковых улыбок при помощи очков, я старался выработать особую, внушающую уважение, повадку.	Михаил Булгаков. Полотенце с петухом.	http://az.lib.ru/b/bulgakow_m_a/text_01_1926_polotentze_s_petuhom.shtml
 Говорить пытался размеренно и веско, порывистые движения по возможности сдержать, не бегать, как бегают люди в двадцать три года, окончившие университет, а ходить.	Михаил Булгаков. Полотенце с петухом.	http://az.lib.ru/b/bulgakow_m_a/text_01_1926_polotentze_s_petuhom.shtml
 Выходило все это, как теперь, по прошествии многих лет, понимаю, очень плохо.	Михаил Булгаков. Полотенце с петухом.	http://az.lib.ru/b/bulgakow_m_a/text_01_1926_polotentze_s_petuhom.shtml
 В данный момент я этот свой неписаный кодекс поведения нарушил.	Михаил Булгаков. Полотенце с петухом.	http://az.lib.ru/b/bulgakow_m_a/text_01_1926_polotentze_s_petuhom.shtml
 Сидел, скорчившись, сидел в одних носках, и не где-нибудь в кабинете, а сидел в кухне и, как огнепоклонник, вдохновенно и страстно тянулся к пылающим в плите березовым поленьям.	Михаил Булгаков. Полотенце с петухом.	http://az.lib.ru/b/bulgakow_m_a/text_01_1926_polotentze_s_petuhom.shtml
 На левой руке у меня стояла перевернутая дном кверху кадушка, и на ней лежали мои ботинки, рядом с ними ободранный, голокожий петух с окровавленной шеей, рядом с петухом его разноцветные перья грудой.	Михаил Булгаков. Полотенце с петухом.	http://az.lib.ru/b/bulgakow_m_a/text_01_1926_polotentze_s_petuhom.shtml
 Дело в том, что еще в состоянии окоченения я успел произвести целый ряд действий, которых потребовала сама жизнь.	Михаил Булгаков. Полотенце с петухом.	http://az.lib.ru/b/bulgakow_m_a/text_01_1926_polotentze_s_petuhom.shtml
 Востроносая Аксинья, жена Егорыча, была утверждена мною в должности моей кухарки.	Михаил Булгаков. Полотенце с петухом.	http://az.lib.ru/b/bulgakow_m_a/text_01_1926_polotentze_s_petuhom.shtml
 Вследствие этого и погиб под ее руками петух.	Михаил Булгаков. Полотенце с петухом.	http://az.lib.ru/b/bulgakow_m_a/text_01_1926_polotentze_s_petuhom.shtml
 Его я должен был съесть.	Михаил Булгаков. Полотенце с петухом.	http://az.lib.ru/b/bulgakow_m_a/text_01_1926_polotentze_s_petuhom.shtml
 Я со всеми перезнакомился.	Михаил Булгаков. Полотенце с петухом.	http://az.lib.ru/b/bulgakow_m_a/text_01_1926_polotentze_s_petuhom.shtml
 Фельдшера звали Демьян Лукич, акушерок — Пелагея Ивановна и Анна Николаевна.	Михаил Булгаков. Полотенце с петухом.	http://az.lib.ru/b/bulgakow_m_a/text_01_1926_polotentze_s_petuhom.shtml
 Я успел обойти больницу и с совершеннейшей ясностью убедился в том, что инструментарий в ней богатейший.	Михаил Булгаков. Полотенце с петухом.	http://az.lib.ru/b/bulgakow_m_a/text_01_1926_polotentze_s_petuhom.shtml
 При этом с тою же ясностью я вынужден был признать (про себя, конечно), что очень многих блестящих девственно инструментов назначение мне вовсе неизвестно.	Михаил Булгаков. Полотенце с петухом.	http://az.lib.ru/b/bulgakow_m_a/text_01_1926_polotentze_s_petuhom.shtml
 Я их не только не держал в руках, но даже, откровенно признаюсь, и не видел.	Михаил Булгаков. Полотенце с петухом.	http://az.lib.ru/b/bulgakow_m_a/text_01_1926_polotentze_s_petuhom.shtml
 — Гм, — очень многозначительно промычал я, — однако у вас инструментарий прелестный.	Михаил Булгаков. Полотенце с петухом.	http://az.lib.ru/b/bulgakow_m_a/text_01_1926_polotentze_s_petuhom.shtml
 Гм...	Михаил Булгаков. Полотенце с петухом.	http://az.lib.ru/b/bulgakow_m_a/text_01_1926_polotentze_s_petuhom.shtml
 — Как же-с, — сладко заметил Демьян Лукич, — это все стараниями вашего предшественника Леопольда Леопольдовича.	Михаил Булгаков. Полотенце с петухом.	http://az.lib.ru/b/bulgakow_m_a/text_01_1926_polotentze_s_petuhom.shtml
 Он ведь с утра до вечера оперировал.	Михаил Булгаков. Полотенце с петухом.	http://az.lib.ru/b/bulgakow_m_a/text_01_1926_polotentze_s_petuhom.shtml
 Тут я облился прохладным потом и тоскливо поглядел на зеркальные сияющие шкафики.	Михаил Булгаков. Полотенце с петухом.	http://az.lib.ru/b/bulgakow_m_a/text_01_1926_polotentze_s_petuhom.shtml
 Засим мы обошли пустые палаты, и я убедился, что в них свободно можно разместить сорок человек.	Михаил Булгаков. Полотенце с петухом.	http://az.lib.ru/b/bulgakow_m_a/text_01_1926_polotentze_s_petuhom.shtml
 — У Леопольда Леопольдовича иногда и пятьдесят лежало, — утешал меня Демьян Лукич, а Анна Николаевна, женщина в короне поседевших волос, к чему-то сказала: — Вы, доктор, так моложавы, так моложавы...	Михаил Булгаков. Полотенце с петухом.	http://az.lib.ru/b/bulgakow_m_a/text_01_1926_polotentze_s_petuhom.shtml
 Прямо удивительно.	Михаил Булгаков. Полотенце с петухом.	http://az.lib.ru/b/bulgakow_m_a/text_01_1926_polotentze_s_petuhom.shtml
 Вы на студента похожи.	Михаил Булгаков. Полотенце с петухом.	http://az.lib.ru/b/bulgakow_m_a/text_01_1926_polotentze_s_petuhom.shtml
" ""Фу ты, черт, — подумал я, — как сговорились, честное слово!"" И проворчал сквозь зубы, сухо: — Гм... нет, я..."	Михаил Булгаков. Полотенце с петухом.	http://az.lib.ru/b/bulgakow_m_a/text_01_1926_polotentze_s_petuhom.shtml
 Затем мы спустились в аптеку, и сразу я увидел, что в ней не было только птичьего молока.	Михаил Булгаков. Полотенце с петухом.	http://az.lib.ru/b/bulgakow_m_a/text_01_1926_polotentze_s_petuhom.shtml
 В темноватых двух комнатах крепко пахло травами, и на полках стояло все что угодно.	Михаил Булгаков. Полотенце с петухом.	http://az.lib.ru/b/bulgakow_m_a/text_01_1926_polotentze_s_petuhom.shtml
 Были даже патентованные заграничные средства, и нужно ли добавлять, что я никогда не слыхал о них ничего.	Михаил Булгаков. Полотенце с петухом.	http://az.lib.ru/b/bulgakow_m_a/text_01_1926_polotentze_s_petuhom.shtml
